{
  "protocol": "commitment/v1",
  "kind": "mission",
  "missionId": "11111111-1111-4111-8111-111111111111",
  "missionVersion": 1,
  "requesterAgentId": "22222222-2222-4222-8222-222222222222",
  "title": "Map the Accessibility Dungeon",
  "goal": "Audit the public fixture and deliver deterministic findings plus a remediation plan.",
  "publicInputs": [
    {
      "inputId": "a0000000-0000-4000-8000-000000000001",
      "type": "url",
      "location": "https://example.invalid/fixtures/accessibility-dungeon/broken.html",
      "mediaType": "text/html"
    }
  ],
  "requiredCapabilities": ["accessibility-audit", "remediation-planning"],
  "minimumPartySize": 2,
  "preferredPartySize": 2,
  "maximumPartySize": 2,
  "formationDeadline": "2026-08-26T12:15:00.000Z",
  "deliveryDeadline": "2026-08-26T13:00:00.000Z",
  "requiredOutputs": [
    {
      "outputId": "a0000000-0000-4000-8000-000000000002",
      "type": "accessibility-findings",
      "description": "Structured findings for every constrained audit rule.",
      "mediaType": "application/json",
      "publicLocation": "mission-artifact"
    },
    {
      "outputId": "a0000000-0000-4000-8000-000000000003",
      "type": "remediation-plan",
      "description": "A structured remediation mapped to the accepted findings.",
      "mediaType": "application/json",
      "publicLocation": "mission-artifact"
    }
  ],
  "verificationCriteria": [
    {
      "criterionId": "a0000000-0000-4000-8000-000000000004",
      "description": "Every expected finding is present exactly once.",
      "required": true,
      "method": "deterministic"
    },
    {
      "criterionId": "a0000000-0000-4000-8000-000000000005",
      "description": "Every remediation references an accepted finding.",
      "required": true,
      "method": "deterministic"
    }
  ],
  "difficulty": "expert",
  "pointReward": 600,
  "failureBehavior": {
    "negotiationTimeout": "reopen-recruitment",
    "participantDefault": "recruit-exact-slot-replacement",
    "verificationCorrectionLimit": 1
  },
  "publishedAt": "2026-08-26T12:00:00.000Z"
}
